{
  "harness": "claude",
  "version": "2.1.283",
  "synthetic": false,
  "provenance": "captured",
  "source": {
    "path": "tests/fixtures/captures/claude-2.1.283-linux-print.jsonl",
    "commit": "8c975f3",
    "key": "SessionStart#4"
  },
  "payload": {
    "session_id": "50d14cd6-cdbc-46cd-bac0-5d43b5a525b0",
    "transcript_path": "/home/user/vouch-workflows/reports/capture2/claude-print/config/projects/-home-user-vouch-workflows-reports-capture2-claude-print-project/50d14cd6-cdbc-46cd-bac0-5d43b5a525b0.jsonl",
    "cwd": "/home/user/vouch-workflows/reports/capture2/claude-print/project",
    "prompt_id": "45f22ee5-566f-496b-aaa2-1ce0cd2a7a7c",
    "hook_event_name": "SessionStart",
    "source": "compact",
    "model": "vouch-capture-model"
  }
}
