{
  "harness": "codex",
  "version": null,
  "synthetic": false,
  "provenance": "imported",
  "source": {
    "path": "docs/aidlc-v2-reference/tests/fixtures/codex-hook-payloads/payloads.json",
    "commit": "a1aedb4",
    "key": "postToolUse_applyPatch_plain"
  },
  "payload": {
    "session_id": "019eb8be-e4fe-7a42-ba1b-e5f963dbddc9",
    "turn_id": "019eb8c0-1f54-7691-920f-c83b886b1161",
    "transcript_path": "/tmp/example-project/codex-home/sessions/2026/06/12/rollout-2026-06-12T08-12-58-019eb8be-e4fe-7a42-ba1b-e5f963dbddc9.jsonl",
    "cwd": "/tmp/example-project/e1-hooks",
    "hook_event_name": "PostToolUse",
    "model": "openai.gpt-5.5",
    "permission_mode": "default",
    "tool_name": "apply_patch",
    "tool_input": {
      "command": "*** Begin Patch\n*** Add File: proof.txt\n+start\n*** End Patch\n"
    },
    "tool_response": "Exit code: 0\nWall time: 0.2 seconds\nOutput:\nSuccess. Updated the following files:\nA proof.txt\n",
    "tool_use_id": "call_1"
  }
}
