{
  "harness": "codex",
  "version": "0.153.4",
  "synthetic": false,
  "provenance": "captured",
  "source": {
    "path": "tests/fixtures/captures/codex-0.153.4-linux-exec.jsonl",
    "commit": "8c975f3",
    "key": "PreToolUse.request_user_input#1"
  },
  "payload": {
    "session_id": "01a0e853-571e-7581-8375-a05579c9e81f",
    "turn_id": "01a0e853-5751-7a10-91a1-e1544e20373e",
    "transcript_path": "/home/user/vouch-workflows/reports/capture/codex-exec/home/sessions/2026/09/28/rollout-2026-09-28T14-02-51-01a0e853-571e-7581-8375-a05579c9e81f.jsonl",
    "cwd": "/home/user/vouch-workflows/reports/capture/codex-exec/project",
    "hook_event_name": "PreToolUse",
    "model": "gpt-6-astra",
    "permission_mode": "bypassPermissions",
    "tool_name": "request_user_input",
    "tool_input": {
      "questions": [
        {
          "id": "capture_option",
          "header": "Capture",
          "question": "Which capture option applies?",
          "options": [
            {
              "label": "Option A (Recommended)",
              "description": "Fixture answer A"
            },
            {
              "label": "Option B",
              "description": "Fixture answer B"
            }
          ]
        }
      ]
    },
    "tool_use_id": "call_vouch_capture_5"
  }
}
