{
  "harness": "claude",
  "version": "2.1.283",
  "synthetic": false,
  "provenance": "captured",
  "source": {
    "path": "tests/fixtures/captures/claude-2.1.283-linux-tty.jsonl",
    "commit": "8c975f3",
    "key": "SessionStart#1"
  },
  "payload": {
    "session_id": "13a308d2-daf4-47fd-8324-fd7c362eb753",
    "transcript_path": "/home/user/vouch-workflows/reports/capture2/claude-tty/config/projects/-home-user-vouch-workflows-reports-capture2-claude-tty-project/13a308d2-daf4-47fd-8324-fd7c362eb753.jsonl",
    "cwd": "/home/user/vouch-workflows/reports/capture2/claude-tty/project",
    "hook_event_name": "SessionStart",
    "source": "startup",
    "model": "vouch-capture-model"
  }
}
