{
  "harness": "codex",
  "version": null,
  "synthetic": false,
  "provenance": "imported",
  "source": {
    "path": "docs/aidlc-v2-reference/tests/fixtures/codex-hook-payloads/payloads.json",
    "commit": "a1aedb4",
    "key": "postToolUse_applyPatch_aidlcDocs"
  },
  "payload": {
    "session_id": "019eb8e6-d5c4-72e1-8ff5-6f009cdf2f8e",
    "turn_id": "019eb8e6-d646-7e43-935d-86963221cf47",
    "transcript_path": "/tmp/example-project/codex-home/sessions/2026/06/12/rollout-2026-06-12T08-56-36-019eb8e6-d5c4-72e1-8ff5-6f009cdf2f8e.jsonl",
    "cwd": "/tmp/example-project/e4-skill",
    "hook_event_name": "PostToolUse",
    "model": "openai.gpt-5.5",
    "permission_mode": "bypassPermissions",
    "tool_name": "apply_patch",
    "tool_input": {
      "command": "*** Begin Patch\n*** Add File: aidlc-docs/ideation/intent-capture/intent-capture-questions.md\n+# Intent Capture Questions\n+\n+## Q1. What business problem are we solving?\n+\n+A. Users need a fast way to calculate a restaurant tip and total from a bill amount.\n+B. Users need to split complex group bills with many participants.\n+C. Users need to track long-term dining expenses and budgets.\n+D. Users need a graphical point-of-sale workflow.\n+E. Users need a tax and receipt management system.\n+X. Other (please specify)\n+\n+[Answer]: A - auto-answer; the requested initiative is \"building a tiny CLI tip calculator.\"\n+\n+## Q2. Who is the customer and what pain are they experiencing?\n+\n+A. Individual command-line users who want quick, no-friction tip math without opening another app.\n+B. Restaurant staff managing tables and orders.\n+C. Finance teams reconciling corporate meals.\n+D. Developers building a larger payments platform.\n+E. Event organizers splitting costs across attendees.\n+X. Other (please specify)\n+\n+[Answer]: A - auto-answer; the expected user is a CLI user doing simple bill math.\n+\n+## Q3. What does success look like?\n+\n+A. Given a bill amount and tip percentage, the CLI prints the tip amount and final total clearly.\n+B. The CLI integrates with bank accounts.\n+C. The CLI stores historical spending by merchant.\n+D. The CLI produces printable receipts.\n+E. The CLI supports multi-currency tax rules.\n+X. Other (please specify)\n+\n+[Answer]: A - auto-answer; minimal success is correct calculation and readable output.\n+\n+## Q4. What is the trigger for this initiative?\n+\n+A. A small greenfield proof of concept is needed to exercise the AI-DLC workflow with a simple usable utility.\n+B. A regulatory deadline requires a compliance calculator.\n+C. A production outage requires an urgent patch.\n+D. A market expansion requires payment localization.\n+E. A legacy billing system needs replacement.\n+X. Other (please specify)\n+\n+[Answer]: A - auto-answer; the invocation requests a tiny CLI calculator.\n*** Add File: aidlc-docs/ideation/intent-capture/intent-statement.md\n+# Intent Statement\n+\n+## Problem Statement\n+\n+People occasionally need to calculate a tip and total bill amount quickly. The initiative is to build a tiny command-line tip calculator that accepts simple inputs and returns clear monetary output without requiring a graphical app or manual arithmetic.\n+\n+## Target Customer\n+\n+The target customer is an individual command-line user, such as a developer or terminal-comfortable user, who wants fast tip math for a bill amount and chosen tip percentage.\n+\n+## Success Metrics\n+\n+- The CLI accepts a bill amount and tip percentage.\n+- The CLI calculates the tip amount and total amount correctly to two decimal places.\n+- The CLI prints output that clearly labels the bill, tip, and total.\n+- The happy path can be verified with a simple command or automated test.\n+\n+## Initiative Trigger\n+\n+This is a small greenfield proof of concept requested through an AI-DLC run. The trigger is to validate the workflow while producing a simple utility with a narrow, inspectable outcome.\n+\n+## Initial Scope Signal\n+\n+The initial scope is `poc`. The first useful version should stay limited to single-bill, single-tip calculation. Splitting bills, tax handling, persistence, currency conversion, and graphical interfaces are out of scope unless later stages explicitly expand the scope.\n*** Add File: aidlc-docs/ideation/intent-capture/stakeholder-map.md\n+# Stakeholder Map\n+\n+## Key Stakeholders\n+\n+| Stakeholder | Interest |\n+|-------------|----------|\n+| CLI user | Gets a quick, accurate tip and total calculation. |\n+| Product owner | Keeps the proof of concept focused and small. |\n+| Developer | Receives clear requirements for input handling, calculation, and output formatting. |\n+| Quality reviewer | Verifies deterministic calculation behavior and user-facing output. |\n+\n+## Decision-Makers vs. Influencers\n+\n+| Role | Classification | Decision Area |\n+|------|----------------|---------------|\n+| Product owner | Decision-maker | Confirms scope, success criteria, and exclusions. |\n+| CLI user | Influencer | Shapes ergonomics, expected inputs, and readable output. |\n+| Developer | Influencer | Identifies implementation constraints and sensible defaults. |\n+| Quality reviewer | Influencer | Defines verification expectations for numeric correctness. |\n+\n+## Communication Requirements\n+\n+- Keep language non-technical when describing the user outcome.\n+- Preserve explicit scope boundaries so later stages do not expand the tool beyond a tiny proof of concept by accident.\n+- Record any later decision to add bill splitting, tax handling, persistence, or currency support as a scope change.\n*** Update File: aidlc-docs/ideation/intent-capture/memory.md\n@@\n ## Interpretations\n <!-- example: 2026-05-29T10:14:32Z — chose REST over GraphQL; the consuming team only needs CRUD, revisit if subscriptions land -->\n+- 2026-06-11T22:57:34Z — interpreted \"tiny CLI tip calculator\" as a single-bill, single-tip proof of concept; this keeps ideation focused on the requested CLI utility rather than a broader expense or payment product.\n@@\n ## Deviations\n <!-- example: 2026-05-29T10:14:32Z — skipped the optional caching layer the stage prose suggested; the dataset is small enough that it adds risk -->\n+- 2026-06-11T22:57:34Z - skipped interactive mode selection and follow-up questions; the run auto-selected guided mode, auto-answered option A, and bypassed ambiguity checks.\n@@\n ## Tradeoffs\n <!-- example: 2026-05-29T10:14:32Z — picked TDD over BDD this run; the team is unit-first and the domain is well-understood -->\n+- 2026-06-11T22:57:34Z — kept artifacts minimal; the workflow state is `Depth: Minimal` and the requested product has a deliberately narrow outcome.\n*** End Patch\n"
    },
    "tool_response": "Exit code: 0\nWall time: 0.8 seconds\nOutput:\nSuccess. Updated the following files:\nA aidlc-docs/ideation/intent-capture/intent-capture-questions.md\nA aidlc-docs/ideation/intent-capture/intent-statement.md\nA aidlc-docs/ideation/intent-capture/stakeholder-map.md\nM aidlc-docs/ideation/intent-capture/memory.md\n",
    "tool_use_id": "call_1"
  }
}
