{
  "harness": "codex",
  "version": "0.153.4",
  "synthetic": false,
  "provenance": "captured",
  "source": {
    "path": "tests/fixtures/captures/codex-0.153.4-linux-exec.jsonl",
    "commit": "8c975f3",
    "key": "SessionStart#2"
  },
  "payload": {
    "session_id": "01a0e853-571e-7581-8375-a05579c9e81f",
    "transcript_path": "/home/user/vouch-workflows/reports/capture/codex-exec/home/sessions/2026/09/28/rollout-2026-09-28T14-02-51-01a0e853-571e-7581-8375-a05579c9e81f.jsonl",
    "cwd": "/home/user/vouch-workflows/reports/capture/codex-exec/project",
    "hook_event_name": "SessionStart",
    "model": "gpt-6-astra",
    "permission_mode": "bypassPermissions",
    "source": "resume"
  }
}
