{
  "harness": "claude",
  "version": "2.1.283",
  "synthetic": false,
  "provenance": "captured",
  "source": {
    "path": "tests/fixtures/captures/claude-2.1.283-linux-print.jsonl",
    "commit": "8c975f3",
    "key": "SubagentStop#1"
  },
  "payload": {
    "session_id": "50d14cd6-cdbc-46cd-bac0-5d43b5a525b0",
    "transcript_path": "/home/user/vouch-workflows/reports/capture2/claude-print/config/projects/-home-user-vouch-workflows-reports-capture2-claude-print-project/50d14cd6-cdbc-46cd-bac0-5d43b5a525b0.jsonl",
    "cwd": "/home/user/vouch-workflows/reports/capture2/claude-print/project",
    "prompt_id": "05c87cd6-5589-4f0e-bb63-bf679aff8b20",
    "permission_mode": "acceptEdits",
    "agent_id": "a2c307ce71debddca",
    "agent_type": "general-purpose",
    "effort": {
      "level": "high"
    },
    "hook_event_name": "SubagentStop",
    "stop_hook_active": false,
    "agent_transcript_path": "/home/user/vouch-workflows/reports/capture2/claude-print/config/projects/-home-user-vouch-workflows-reports-capture2-claude-print-project/50d14cd6-cdbc-46cd-bac0-5d43b5a525b0/subagents/agent-a2c307ce71debddca.jsonl",
    "last_assistant_message": "Local fixture exercise completed.",
    "background_tasks": [
      {
        "id": "a2c307ce71debddca",
        "type": "subagent",
        "status": "running",
        "description": "Capture subagent",
        "agent_type": "general-purpose"
      }
    ],
    "session_crons": []
  }
}
