{
  "harness": "claude",
  "version": "2.1.280",
  "synthetic": false,
  "provenance": "captured",
  "source": {
    "path": "tests/fixtures/captures/claude-2.1.280.jsonl",
    "commit": "d4d5a02",
    "key": "UserPromptSubmit"
  },
  "payload": {
    "session_id": "85ac9d2c-08a1-4d04-b62b-773405fd8e6d",
    "transcript_path": "C:\\Users\\saedg\\.claude\\projects\\C--Users-saedg-AppData-Local-Temp-vouch-capture-20260927\\85ac9d2c-08a1-4d04-b62b-773405fd8e6d.jsonl",
    "cwd": "C:\\Users\\saedg\\AppData\\Local\\Temp\\vouch-capture-20260927",
    "prompt_id": "9dee29f4-7677-43c5-94a2-c4c1996d9343",
    "permission_mode": "default",
    "hook_event_name": "UserPromptSubmit",
    "prompt": "Vouch fixture capture. The UserPromptSubmit hook blocks this prompt before model execution."
  }
}
