{
  "harness": "claude",
  "version": "2.1.283",
  "synthetic": false,
  "provenance": "captured",
  "source": {
    "path": "tests/fixtures/captures/claude-2.1.283-linux-print.jsonl",
    "commit": "8c975f3",
    "key": "PostToolUse.Bash#1"
  },
  "payload": {
    "session_id": "50d14cd6-cdbc-46cd-bac0-5d43b5a525b0",
    "transcript_path": "/home/user/vouch-workflows/reports/capture2/claude-print/config/projects/-home-user-vouch-workflows-reports-capture2-claude-print-project/50d14cd6-cdbc-46cd-bac0-5d43b5a525b0.jsonl",
    "cwd": "/home/user/vouch-workflows/reports/capture2/claude-print/project",
    "prompt_id": "05c87cd6-5589-4f0e-bb63-bf679aff8b20",
    "permission_mode": "acceptEdits",
    "effort": {
      "level": "high"
    },
    "hook_event_name": "PostToolUse",
    "tool_name": "Bash",
    "tool_input": {
      "command": "echo vouch-capture",
      "description": "Print a constant"
    },
    "tool_response": {
      "stdout": "vouch-capture",
      "stderr": "",
      "interrupted": false,
      "isImage": false,
      "noOutputExpected": false
    },
    "tool_use_id": "toolu_vouch_capture_2",
    "duration_ms": 420
  }
}
