{
  "harness": "codex",
  "version": null,
  "synthetic": false,
  "provenance": "imported",
  "source": {
    "path": "docs/aidlc-v2-reference/tests/fixtures/codex-hook-payloads/payloads.json",
    "commit": "a1aedb4",
    "key": "postToolUse_updatePlan_slug"
  },
  "payload": {
    "session_id": "019eb916-28ed-76f3-be31-29fd14b24e6e",
    "turn_id": "019eb916-29a5-7800-99d9-75b115d3b0ae",
    "transcript_path": "/tmp/example-project/codex-home/sessions/2026/06/12/rollout-2026-06-12T09-48-17-019eb916-28ed-76f3-be31-29fd14b24e6e.jsonl",
    "cwd": "/tmp/example-project/e1-hooks",
    "hook_event_name": "PostToolUse",
    "model": "openai.gpt-5.5",
    "permission_mode": "bypassPermissions",
    "tool_name": "update_plan",
    "tool_input": {
      "plan": [
        {
          "step": "Running Intent Capture [intent-capture]",
          "status": "in_progress"
        },
        {
          "step": "step two",
          "status": "pending"
        }
      ]
    },
    "tool_response": "Plan updated",
    "tool_use_id": "call_0"
  }
}
