{
  "harness": "claude",
  "version": "2.1.280",
  "synthetic": false,
  "provenance": "captured",
  "source": {
    "path": "tests/fixtures/captures/claude-2.1.280-write.jsonl",
    "commit": "eb5bbc5",
    "key": "PostToolUse.Write"
  },
  "payload": {
    "session_id": "dd8a5902-9220-402d-bf7d-f25e04d2b532",
    "transcript_path": "C:\\Users\\saedg\\apps\\vouch-workflows\\reports\\tool-capture\\claude\\config\\projects\\C--Users-saedg-apps-vouch-workflows-reports-tool-capture-claude-project\\dd8a5902-9220-402d-bf7d-f25e04d2b532.jsonl",
    "cwd": "C:\\Users\\saedg\\apps\\vouch-workflows\\reports\\tool-capture\\claude\\project",
    "prompt_id": "7e30a5d8-da41-47e8-8782-1b06f6ef4cb5",
    "permission_mode": "acceptEdits",
    "effort": {
      "level": "medium"
    },
    "hook_event_name": "PostToolUse",
    "tool_name": "Write",
    "tool_input": {
      "file_path": "C:\\Users\\saedg\\apps\\vouch-workflows\\reports\\tool-capture\\claude\\project\\intent.md",
      "content": "---\nstatus: draft\n---\n# Capture only\n"
    },
    "tool_response": {
      "type": "create",
      "filePath": "C:\\Users\\saedg\\apps\\vouch-workflows\\reports\\tool-capture\\claude\\project\\intent.md",
      "content": "---\nstatus: draft\n---\n# Capture only\n",
      "structuredPatch": [],
      "originalFile": null,
      "userModified": false
    },
    "tool_use_id": "toolu_vouch_capture_write",
    "duration_ms": 66
  }
}
